{
  "id": "galatia",
  "names": {
    "ancient": [
      "Galatia"
    ],
    "modern": "Central Türkiye",
    "modernCountries": [
      "Türkiye"
    ],
    "alternate": []
  },
  "type": "province",
  "zoomTier": "region",
  "prominence": "major",
  "parentId": "roman-empire",
  "candidates": [
    {
      "label": "Galatia (region and Roman province, label point)",
      "coordinates": [
        32.983333,
        39.266667
      ],
      "coordinateSource": "wikidata:Q26847",
      "confidence": "high",
      "support": "Galatia was, per Wikidata, the highland area of central Asia Minor; Celtic (Gaulish) migrants had migrated to Asia Minor by 278 BC, and the region was organized as a Roman province in 25 BC (per bib:zondervan-who-were-galatians). The label point is Wikidata's coordinate for the region; Pleiades' 'Galatia' province/region label (a separate entity from the late Roman 'Galatia I' record) is about 90 km away, a reasonable margin for a region label.",
      "sources": [
        "pleiades:619161",
        "wikidata:Q26847",
        "bib:zondervan-who-were-galatians"
      ]
    }
  ],
  "summary": {
    "text": "Galatia was both an ethnic homeland of Celtic settlers in the highlands of central Asia Minor and, from 25 BC, a much larger Roman province of the same name. Celtic migrants, whom the Greeks and Romans called Galatians, had crossed into Asia Minor by 278 BC and settled around the headwaters of the Sangarios river and the middle course of the Halys. The Roman province, formed when Rome annexed the client kingdom in 25 BC, reached far south of this Celtic homeland to take in parts of Phrygia, Pisidia, and Lycaonia, including the cities of Antioch in Pisidia, Iconium, Lystra, and Derbe.",
    "sources": [
      "pleiades:619161",
      "wikidata:Q26847",
      "wikidata:Q1249412",
      "bib:zondervan-who-were-galatians",
      "bib:isbe-galatia"
    ]
  },
  "history": [
    {
      "text": "Paul's letter to the Galatians is addressed to \"the assemblies of Galatia,\" but which congregations he meant has long been debated. The \"North Galatian\" view holds that he wrote to ethnic-Galatian congregations in the province's northern, Celtic-settled region; the \"South Galatian\" view holds that he wrote to the congregations in the province's southern cities, which he reached on his first missionary journey. This map favors neither view. Acts twice describes Paul traveling through the region of Galatia and nearby Phrygia, and in 1 Corinthians he mentions a collection organized among \"the assemblies of Galatia.\"",
      "sources": [
        "scripture:Galatians 1:2",
        "scripture:Acts 16:6",
        "scripture:Acts 18:23",
        "scripture:1 Corinthians 16:1",
        "scripture:Acts 13:14",
        "scripture:Acts 14:6",
        "bib:zondervan-who-were-galatians"
      ]
    },
    {
      "text": "The Roman province of Galatia was formed in 25 BC and governed from the city of Ancyra; in its larger first-century extent it also included Pisidia and Lycaonia, until the emperor Vespasian detached most of Pisidia in AD 74. The letter of 1 Peter is addressed to believers scattered across Galatia and four neighboring regions: Pontus, Cappadocia, Asia, and Bithynia.",
      "sources": [
        "bib:zondervan-who-were-galatians",
        "wikidata:Q1249412",
        "scripture:1 Peter 1:1",
        "bib:worldhistory-vespasian"
      ]
    },
    {
      "text": "Galatia's former territory lies today within Türkiye, across the high country of the Anatolian plateau.",
      "sources": [
        "wikidata:Q26847",
        "bib:isbe-galatia"
      ]
    }
  ],
  "scripture": [
    {
      "ref": "Acts 16:6",
      "book": "Acts",
      "textWEB": "When they had gone through the region of Phrygia and Galatia, they were forbidden by the Holy Spirit to speak the word in Asia."
    },
    {
      "ref": "Acts 18:23",
      "book": "Acts",
      "textWEB": "Having spent some time there, he departed and went through the region of Galatia and Phrygia, in order, establishing all the disciples."
    },
    {
      "ref": "1 Corinthians 16:1",
      "book": "1 Corinthians",
      "textWEB": "Now concerning the collection for the saints: as I commanded the assemblies of Galatia, you do likewise."
    },
    {
      "ref": "Galatians 1:2",
      "book": "Galatians",
      "textWEB": "and all the brothers who are with me, to the assemblies of Galatia:"
    },
    {
      "ref": "2 Timothy 4:10",
      "book": "2 Timothy",
      "textWEB": "for Demas left me, having loved this present world, and went to Thessalonica; Crescens to Galatia; and Titus to Dalmatia."
    },
    {
      "ref": "1 Peter 1:1",
      "book": "1 Peter",
      "textWEB": "Peter, an apostle of Jesus Christ, to the chosen ones who are living as foreigners in the Dispersion in Pontus, Galatia, Cappadocia, Asia, and Bithynia,"
    },
    {
      "ref": "Acts 13:14",
      "book": "Acts",
      "textWEB": "But they, passing on from Perga, came to Antioch of Pisidia. They went into the synagogue on the Sabbath day and sat down."
    },
    {
      "ref": "Acts 14:6",
      "book": "Acts",
      "textWEB": "they became aware of it and fled to the cities of Lycaonia, Lystra, Derbe, and the surrounding region."
    }
  ],
  "otConnections": [],
  "politicalHistory": [
    {
      "fromYear": -25,
      "toYear": 101,
      "holderId": "galatia-province",
      "entity": "Roman province of Galatia",
      "sources": [
        "bib:isbe-galatia",
        "bib:isbe-pisidia",
        "bib:zondervan-who-were-galatians",
        "bib:strabo-geography",
        "bib:livius-cappadocia"
      ],
      "note": "Includes Pisidia, Lycaonia (the western part) and Paphlagonia, which had already joined the province of Galatia (Pisidia and Lycaonia in 25 BC on King Amyntas's death; Paphlagonia in 6 BC) before 4 BC. The emperor Vespasian detached most of Pisidia to the new province of Lycia and Pamphylia in AD 74; no source describing exactly where that internal line ran was found, so this area is kept whole rather than guessing at a split. Galatia and Cappadocia may have shared one governor from about AD 69 (see the Cappadocia area's own note), though no ancient source states a merger outright, so they stay two areas with their own holders. Pontus Galaticus, part of this province from 2 BC, and Polemon's former kingdom, part of it from AD 64, are drawn in the area of Pontus (see its note)."
    }
  ],
  "status": "verified",
  "verifiedBy": "fact-checker",
  "lastReviewed": "2026-10-19",
  "politicalAreaId": "galatia"
}
